{"destination_domain_id":"worker","evidence_sha256":"52fe4379e143aa73a0e8f4231bd2e2978c44a02f3672ccab063c87b0d586b45b","finished_at":"2026-07-11T12:00:30Z","max_absolute_skew_ms":0.1,"method":"measured_skew","policy":{"maximum_absolute_skew_ms":1,"method":"measured_skew","minimum_samples":2},"relation_id":"control-worker-clock","run_id":"run-00000000-0000-4000-8000-000000000001","sample_count":30,"scenario_sha256":"9b1c47e35a72f456a04da6775816626e2baf26f134ab3c896b1176b55f51bef9","schema_version":"clock-relation.v1","source_domain_id":"control","started_at":"2026-07-11T12:00:00Z","status":"passed","sync_protocol":"sim_clock","violations":[]}
